<?xml version="1.0" encoding="UTF-8"?>
<xs:schema xmlns:xs="http://www.w3.org/2001/XMLSchema">

    <xs:element name="bank">
        <xs:complexType>
            <xs:sequence>
                <xs:element name="employees">
                    <xs:complexType>
                        <xs:sequence>
                            <xs:element name="employee" minOccurs="1" maxOccurs="unbounded">
                                <xs:complexType>
                                    <xs:sequence>
                                        <xs:element name="employee_id" type="xs:integer"/>
                                        <xs:element name="first_name" type="xs:string"/>
                                        <xs:element name="last_name" type="xs:string"/>
                                        <xs:element name="birth_date" type="xs:date"/>
                                    </xs:sequence>
                                </xs:complexType>
                            </xs:element>
                        </xs:sequence>
                    </xs:complexType>
                </xs:element>

                <xs:element name="departments">
                    <xs:complexType>
                        <xs:sequence>
                            <xs:element name="department" minOccurs="1" maxOccurs="unbounded">
                                <xs:complexType>
                                    <xs:sequence>
                                        <xs:element name="name" type="xs:string"/>
                                    </xs:sequence>
                                </xs:complexType>
                            </xs:element>
                        </xs:sequence>
                    </xs:complexType>
                </xs:element>

                <xs:element name="accounts">
                    <xs:complexType>
                        <xs:sequence>
                            <xs:element name="account" minOccurs="0" maxOccurs="unbounded">
                                <xs:complexType>
                                    <xs:sequence>
                                        <xs:element name="account_id" type="xs:integer"/>
                                        <xs:element name="account_number" type="xs:string"/>
                                        <xs:element name="balance" type="xs:decimal"/>
                                    </xs:sequence>
                                </xs:complexType>
                            </xs:element>
                        </xs:sequence>
                    </xs:complexType>
                </xs:element>

                <xs:element name="cards">
                    <xs:complexType>
                        <xs:sequence>
                            <xs:element name="card" minOccurs="0" maxOccurs="unbounded">
                                <xs:complexType>
                                    <xs:sequence>
                                        <xs:element name="card_id" type="xs:integer"/>
                                        <xs:element name="card_number" type="xs:string"/>
                                    </xs:sequence>
                                </xs:complexType>
                            </xs:element>
                        </xs:sequence>
                    </xs:complexType>
                </xs:element>

                <xs:element name="branches">
                    <xs:complexType>
                        <xs:sequence>
                            <xs:element name="branch" minOccurs="1" maxOccurs="unbounded">
                                <xs:complexType>
                                    <xs:sequence>
                                        <xs:element name="country" type="xs:string"/>
                                        <xs:element name="city" type="xs:string"/>
                                        <xs:element name="employees_number" type="xs:integer"/>
                                    </xs:sequence>
                                </xs:complexType>
                            </xs:element>
                        </xs:sequence>
                    </xs:complexType>
                </xs:element>

            </xs:sequence>
        </xs:complexType>
    </xs:element>

</xs:schema>
